{
  "type": "experiment",
  "id": "e-0004",
  "stream": "slitherlink-tool-granularity",
  "description": "Phase-1 gate-closing replication of puzzle_002 (7x7 hard), 4 toolsets meta-off, n=3, via the resumable budget-capped run_plan over multiple 5h windows.",
  "motivation": "The pre-committed Phase-1 decision: do the hard-puzzle cost ratios separate with non-overlapping CIs (signal real) or collapse (signal dead)?",
  "code_pointer": {
    "path": "harness/run_plan.py",
    "repo": "claude-sudoku-experiments",
    "commit": "0e31a015d8dab3348b6f48fdca81191e4ff97aa6"
  },
  "formal_results": "cost mu+-sigma (n=3): none $4.75+-0.94; fine $4.45+-0.92; medium $3.29+-0.62; coarse $2.59+-0.49. coarse/none = 0.55x; 1-sigma CIs none [3.81,5.69] vs coarse [2.10,3.09] - a $0.72 gap, non-overlapping. none solves in 2-3 calls yet is priciest; fine 121 calls.",
  "results_description": "On the hard puzzle the granularity cost ordering is statistically real: coarse is ~half the cost of none with separated CIs, inverting the easy-puzzle null result.",
  "conclusions": "Phase-1 gate PASS. The granularity cost-benefit is real but conditional on hard-enough puzzles; also the first clean evidence of the calls/cost decoupling (none 2 calls costs more than fine 121 calls).",
  "addresses": [
    "q-0004",
    "q-0005"
  ],
  "produces": [
    "a-0004",
    "a-0011",
    "a-0012",
    "a-0013"
  ],
  "status": "done",
  "provenance": {
    "created_by": "claude",
    "created_at": "2026-06-03T03:47:35.832Z",
    "updated_at": "2026-06-03T03:47:45.789Z",
    "source_ref": {
      "repo": "claude-sudoku-experiments",
      "commit": "0e31a015d8dab3348b6f48fdca81191e4ff97aa6"
    }
  },
  "comments": {}
}
